<?xml version="1.0" ?>
<!-- Copyright 2016-2020 Pascal COMBES <pascom@orange.fr>

     This file is part of QTestLibPlugin.

     QTestLibPlugin is free software: you can redistribute it and/or modify
     it under the terms of the GNU General Public License as published by
     the Free Software Foundation, either version 3 of the License, or
     (at your option) any later version.

     QTestLibPlugin is distributed in the hope that it will be useful,
     but WITHOUT ANY WARRANTY; without even the implied warranty of
     MERCHANTABILITY or FITNESS FOR A PARTICULAR PURPOSE. See the
     GNU General Public License for more details.

     You should have received a copy of the GNU General Public License
     along with QTestLibPlugin. If not, see <http://www.gnu.org/licenses/>
-->

<!DOCTYPE qtestliboutput SYSTEM "../../qtestliboutput.dtd">
<qtestliboutput>
    <results format="xunitxml">
        <unsure />
        <unsure />
        <unsure />
        <unsure />
        <unsure />
        <unsure />
        <magicfound />
        <unsure />
        <unsure level="verboses" qtmin="5.6.0" />
        <unsure level="verboses" qtmin="5.6.0" />
        <unsure />
        <unsure level="verbose2" />
        <unsure level="verbose2" />
        <unsure />
        <unsure />
        <unsure level="verboses" qtmin="5.12.0" />
        <unsure level="verboses" qtmin="5.12.0" />
        <unsure level="verboses" qtmin="5.6.0" />
        <unsure level="verboses" qtmin="5.6.0" />
        <unsure level="verboses" qtmin="5.12.0" />
        <unsure level="verbose2" />
        <unsure level="verbose2" />
        <unsure />
    </results>
    <results format="lightxml">
        <unsure />
        <unsure />
        <unsure />
        <unsure />
        <magicfound />
        <unsure />
        <unsure level="verboses" qtmin="5.6.0" />
        <unsure level="verboses" qtmin="5.6.0" />
        <unsure level="verboses" qtmin="5.6.0" />
        <unsure />
        <unsure />
        <unsure />
        <unsure />
        <unsure level="verbose2" />
        <unsure level="verbose2" />
        <unsure level="verbose2" />
        <unsure />
        <unsure />
        <unsure />
        <unsure />
        <unsure />
        <unsure />
        <unsure />
        <unsure level="verboses" qtmin="5.12.0" />
        <unsure level="verboses" qtmin="5.12.0" />
        <unsure level="verboses" qtmin="5.12.0" />
        <unsure />
    </results>
    <results format="xml">
        <unsure />
        <unsure />
        <unsure />
        <unsure />
        <unsure />
        <unsure />
        <magicfound />
        <unsure />
        <unsure level="verboses" qtmin="5.6.0" />
        <unsure level="verboses" qtmin="5.6.0" />
        <unsure level="verboses" qtmin="5.6.0" />
        <unsure />
        <unsure />
        <unsure />
        <unsure />
        <unsure level="verbose2" />
        <unsure level="verbose2" />
        <unsure level="verbose2" />
        <unsure />
        <unsure />
        <unsure />
        <unsure />
        <unsure />
        <unsure />
        <unsure />
        <unsure level="verboses" qtmin="5.12.0" />
        <unsure level="verboses" qtmin="5.12.0" />
        <unsure level="verboses" qtmin="5.12.0" />
        <unsure />
        <unsure />
    </results>
    <results format="txt">
        <unsure/>
        <magicfound level="silent" />
        <unsure level="verboses" qtmin="5.6.0" />
        <unsure level="verbose1" />
        <unsure/>
        <unsure level="verbose1" />
        <unsure level="verbose2" />
        <unsure level="verbose2" />
        <unsure/>
        <unsure level="verbose1" />
        <unsure/>
        <unsure level="verboses" qtmin="5.12.0" />
        <unsure level="silent" />
        <unsure/>
    </results>
    <class name="OnePassTest" type="Pass" format="!lightxml" level="normal">
        <function name="initTestCase" type="Pass">
            <message type="Signal" level="verboses" qtmin="5.6.0">
                 <text strict="false">QThread(29ec6f0) started ()</text>
            </message>
            <message type="Info" level="verbose1" format="txt">
                 <text strict="true">entering</text>
            </message>
            <message type="Pass">
                 <text strict="true">Test passed</text>
            </message>
            <message type="Duration" format="xml">
                <text strict="false"> 0.00ms</text>
            </message>
        </function>
        <function name="testPass" type="Pass">
            <message type="Info" level="verbose1" format="txt">
                 <text strict="true">entering</text>
            </message>
            <message type="Info" level="verbose2" file="onepasstest.cpp" line="34">
                 <text strict="true">QVERIFY(true)</text>
            </message>
            <message type="Pass">
                 <text strict="true">Test passed</text>
            </message>
            <message type="Duration" format="xml">
                 <text strict="false">0.00ms</text>
            </message>
        </function>
        <function name="cleanupTestCase" type="Pass">
            <message type="Info" level="verbose1" format="txt">
                 <text strict="true">entering</text>
            </message>
            <message type="Signal" level="verboses" qtmin="5.12.0" format="xunitxml">
                 <text strict="false">QThread(29ec6f0) finished ()</text>
            </message>
            <message type="Pass">
                 <text strict="true">Test passed</text>
            </message>
            <message type="Duration" format="xml">
                 <text strict="false">0.00ms</text>
            </message>
        </function>
        <function name="UnknownTestFunc" type="Unknown" level="verboses" qtmin="5.12.0" format="txt">
            <message type="Signal">
                 <text strict="false">QThread(29ec6f0) finished ()</text>
            </message>
        </function>
        <message type="Signal" level="verboses" qtmin="5.12.0" format="xml">
             <text strict="false">QThread(29ec6f0) finished ()</text>
        </message>
        <message type="Duration" format="xml">
             <text strict="false">0.00ms</text>
        </message>
    </class>
    <class name="OneSubTest" type="Pass" format="lightxml" level="normal">
        <function name="initTestCase" type="Pass">
            <message type="Signal" level="verboses" qtmin="5.6.0">
                 <text strict="false">QThread(29ec6f0) started ()</text>
            </message>
            <message type="Pass">
                 <text strict="true">Test passed</text>
            </message>
            <message type="Duration">
                 <text strict="false">0.00ms</text>
            </message>
        </function>
        <function name="testPass" type="Pass">
            <message type="Info" level="verbose2" file="onepasstest.cpp" line="34">
                 <text strict="true">QVERIFY(true)</text>
            </message>
            <message type="Pass">
                 <text strict="true">Test passed</text>
            </message>
            <message type="Duration">
                 <text strict="false">0.00ms</text>
            </message>
        </function>
        <function name="cleanupTestCase" type="Pass">
            <message type="Pass">
                 <text strict="true">Test passed</text>
            </message>
            <message type="Duration">
                 <text strict="false">0.00ms</text>
            </message>
        </function>
        <message type="Duration">
             <text strict="false">0.00ms</text>
        </message>
    </class>
</qtestliboutput>
